A1: Date | B1: Lecture | C1: Who | D1: Proj. 1 Target | E1: Assignment | F1: Community Service
A2: 38223 | B2: Survey, Syllabus, Intro to Security Auditing | C2: Davis
A3: =A2+2 -> 38225 | B3: Group Assignments, Research Guidelines | C3: Davis | E3: Lab 1 Assigned,
B4: Chapter 8 - Social engineering | C4: Davis | E4: Project 1 Assigned
A5: =A2+7 -> 38230
A7: =A5+2 -> 38232
A9: =A5+7 -> 38237 | B9: Chapter 1 - Hacking Today | C9: Seward
B10: Chapter 2 - Defining the hacker | C10: Fox
A11: =A9+2 -> 38239 | E11: Lab 1 Due/Presentations
E12: Lab 2 Assigned
A13: =A9+7 -> 38244 | B13: Chapter 3 - Penetration for hire | C13: Sudol | E13: Research Proposals Due
B14: Chapter 4 - Where the exposures lie | C14: Bennent
A15: =A13+2 -> 38246 | B15: Chapter 5 - Internet Penetration | C15: Meehan
B16: Chapter 6 - Dial-in penetration | C16: Davis
A17: =A13+7 -> 38251 | B17: Chapter 7 - Internal penetration testing | C17: Pettyjohn
B18: Special Topics - Wireless Networks | C18: Sacilowski, S.
A19: =A17+2 -> 38253 | B19: Chapter 9 - Unix Methods | C19: Meehan | E19: Lab 2 Due
B20: Special Topics - HIPAA | C20: Edmonds
A21: =A17+7 -> 38258 | B21: Chapter 10 - The Tool Kit | C21: Clark | D21: Clark, Daniel
B22: Chapter 11 - Automated Vulnerability Scanners | C22: Gerstein | D22: Sacilowski, Deborah
A23: =A21+2 -> 38260 | B23: Special Topics - Nessus | C23: Laguardia | D23: Dewey, Eileen | E23: Lab 3 Assigned | F23: TCCHD Trip
B24: Chapter 12 - Discovery Tools | D24: Chambers, Julie
A25: =A21+7 -> 38265 | B25: Chapter 13 - Port Scanners | C25: Monteith | D25: Edmonds, Janica
B26: Chapter 14 - Sniffers | C26: Wiley | D26: Gershteyn, Pavel "Paul"
A27: =A25+2 -> 38267 | B27: Special Topics - Bluetooth | C27: Sacilowski, D. | D27: Fisher, Ryan | F27: TCCHD Trip
D28: Bennett, Shane
A29: =A25+7 -> 38272 | B29: Research Topic Presentations | D29: Fox, Jordan | E29: Lab 3 Due | F29: OSDH Trip
D30: Stonebraker, Martin
A31: =A29+2 -> 38274 | B31: Chapter 15 - Password Crackers | C31: Swanson | D31: Blair, Mark | F31: TCCHD Trip
B32: Chapter 16 - Windows NT Tools | C32: Gershteyn | D32: Seward, Brent
A33: =A29+7 -> 38279 | B33: Chapter 17 - Web-Testing Tools | C33: Miazga | D33: Gerstein, Jacob | E33: Research Draft Due
D34: Swanson, Michael
A35: =A33+2 -> 38281 | B35: Chapter 18 Remote Control | C35: Fisher | D35: Griffin, Kevin | F35: TCCHD Trip
B36: Chapter 19 - Intrusion Detection Systems | C36: Heitkamper
A37: =A33+7 -> 38286 | B37: Chapter 20 - Firewalls | C37: Haynes | D37: Gubbels, Kecia | F37: OSDH Trip
D38: Sudol, Stephanie
A39: =A37+2 -> 38288 | B39: Chapter 21 - Denial-of-Service Attacks | C39: Dewey | D39: Haynes, Arlene | F39: TCCHD Trip
B40: Special Topics - Netcat | C40: Blair
A41: =A37+7 -> 38293 | B41: Special Topics - SQL Injection | C41: Chambers | D41: Heitkamper, Albert
D42: Seier, Shelly
A43: =A41+2 -> 38295 | B43: Special Topics - Buffer Overflows and Race Conditions | C43: Blair | D43: LaGuardia, John | F43: TCCHD Trip
B44: Special Topics - Web Server Attacks (Apache and IIS)
A45: =A41+7 -> 38300 | B45: Special Topics - Microsoft Messenger Exploits | D45: Meehan, Anthony
D46: Wiley, Sara
A47: =A45+2 -> 38302 | D47: Miazga, Andrew | E47: Research Papers Due | F47: TCCHD Trip
A49: =A45+7 -> 38307 | B49: Special Topics - RPC Exploits | C49: Quebbeman | D49: Monteith, Kenneth
B50: Special Topics - Terminal Services | D50: Quebbeman, John
A51: =A49+2 -> 38309 | D51: Pettyjohn, Nicholas | F51: TCCHD Trip
B52: Appendix B - 10 Most Common Vulnerabilities | C52: Sacilowski, S. | D52: Sacilowski, Scott
A53: =A49+7 -> 38314 | B53: Thanksgiving Break
A55: =A53+2 -> 38316 | B55: Thanksgiving Break
A57: =A53+7 -> 38321 | F57: Tenative OSHD Trip
B59: Chapter 22 - Wrapping It Up | C59: Griffin | F59: TCCHD Trip
A60: =A57+2 -> 38323 | B60: Chapter 23 Future Trends | C60: Sacilowski, D.
A61: =A57+7 -> 38328
A63: TBA | B63: Final Exam